,cl_node,ref,clause_type,verse_text,cl_text,target_ph,xphrase_function
20445,452647,Judges 11:39,wayehi_x,וַיְהִ֞י מִקֵּ֣ץ׀ שְׁנַ֣יִם חֳדָשִׁ֗ים וַתָּ֨שָׁב֙ אֶל־אָבִ֔יהָ וַיַּ֣עַשׂ לָ֔הּ אֶת־נִדְרֹ֖ו אֲשֶׁ֣ר נָדָ֑ר וְהִיא֙ לֹא־יָדְעָ֣ה אִ֔ישׁ וַתְּהִי־חֹ֖ק בְּיִשְׂרָאֵֽל׃ ,וַיְהִ֞י מִקֵּ֣ץ׀ שְׁנַ֣יִם חֳדָשִׁ֗ים ,מִקֵּ֣ץ׀ שְׁנַ֣יִם חֳדָשִׁ֗ים ,Time
20449,452950,Judges 15:1,wayehi_x,וַיְהִ֨י מִיָּמִ֜ים בִּימֵ֣י קְצִיר־חִטִּ֗ים וַיִּפְקֹ֨ד שִׁמְשֹׁ֤ון אֶת־אִשְׁתֹּו֙ בִּגְדִ֣י עִזִּ֔ים וַיֹּ֕אמֶר אָבֹ֥אָה אֶל־אִשְׁתִּ֖י הֶחָ֑דְרָה וְלֹֽא־נְתָנֹ֥ו אָבִ֖יהָ לָבֹֽוא׃ ,וַיְהִ֨י מִיָּמִ֜ים בִּימֵ֣י קְצִיר־חִטִּ֗ים ,מִיָּמִ֜ים ,Time
20450,453076,Judges 16:4,wayehi_x,וַֽיְהִי֙ אַחֲרֵי־כֵ֔ן וַיֶּאֱהַ֥ב אִשָּׁ֖ה בְּנַ֣חַל שֹׂרֵ֑ק וּשְׁמָ֖הּ דְּלִילָֽה׃ ,וַֽיְהִי֙ אַחֲרֵי־כֵ֔ן ,אַחֲרֵי־כֵ֔ן ,Time
20457,453845,Judges 21:4,wayehi_x,וַֽיְהִי֙ מִֽמָּחֳרָ֔ת וַיַּשְׁכִּ֣ימוּ הָעָ֔ם וַיִּבְנוּ־שָׁ֖ם מִזְבֵּ֑חַ וַיַּעֲל֥וּ עֹלֹ֖ות וּשְׁלָמִֽים׃ פ ,וַֽיְהִי֙ מִֽמָּחֳרָ֔ת ,מִֽמָּחֳרָ֔ת ,Time
20459,453954,1_Samuel 1:4,wayehi_x,וַיְהִ֣י הַיֹּ֔ום וַיִּזְבַּ֖ח אֶלְקָנָ֑ה וְנָתַ֞ן לִפְנִנָּ֣ה אִשְׁתֹּ֗ו וּֽלְכָל־בָּנֶ֛יהָ וּבְנֹותֶ֖יהָ מָנֹֽות׃ ,וַיְהִ֣י הַיֹּ֔ום ,הַיֹּ֔ום ,Time
20460,454027,1_Samuel 1:20,wayehi_x,וַיְהִי֙ לִתְקֻפֹ֣ות הַיָּמִ֔ים וַתַּ֥הַר חַנָּ֖ה וַתֵּ֣לֶד בֵּ֑ן וַתִּקְרָ֤א אֶת־שְׁמֹו֙ שְׁמוּאֵ֔ל כִּ֥י מֵיְהוָ֖ה שְׁאִלְתִּֽיו׃ ,וַיְהִי֙ לִתְקֻפֹ֣ות הַיָּמִ֔ים ,לִתְקֻפֹ֣ות הַיָּמִ֔ים ,Time
20464,454625,1_Samuel 7:2,wayehi_x,וַיְהִ֗י מִיֹּ֞ום שֶׁ֤בֶת הָֽאָרֹון֙ בְּקִרְיַ֣ת יְעָרִ֔ים וַיִּרְבּוּ֙ הַיָּמִ֔ים וַיִּֽהְי֖וּ עֶשְׂרִ֣ים שָׁנָ֑ה וַיִּנָּה֛וּ כָּל־בֵּ֥ית יִשְׂרָאֵ֖ל אַחֲרֵ֥י יְהוָֽה׃ ס ,וַיְהִ֗י מִיֹּ֞ום ,מִיֹּ֞ום ,Time
20467,455129,1_Samuel 11:11,wayehi_x,וַיְהִ֣י מִֽמָּחֳרָ֗ת וַיָּ֨שֶׂם שָׁא֣וּל אֶת־הָעָם֮ שְׁלֹשָׁ֣ה רָאשִׁים֒ וַיָּבֹ֤אוּ בְתֹוךְ־הַֽמַּחֲנֶה֙ בְּאַשְׁמֹ֣רֶת הַבֹּ֔קֶר וַיַּכּ֥וּ אֶת־עַמֹּ֖ון עַד־חֹ֣ם הַיֹּ֑ום וַיְהִ֤י הַנִּשְׁאָרִים֙ וַיָּפֻ֔צוּ וְלֹ֥א נִשְׁאֲרוּ־בָ֖ם שְׁנַ֥יִם יָֽחַד׃ ,וַיְהִ֣י מִֽמָּחֳרָ֗ת ,מִֽמָּחֳרָ֗ת ,Time
20468,455371,1_Samuel 14:1,wayehi_x,וַיְהִ֣י הַיֹּ֗ום וַיֹּ֨אמֶר יֹונָתָ֤ן בֶּן־שָׁאוּל֙ אֶל־הַנַּ֨עַר֙ נֹשֵׂ֣א כֵלָ֔יו לְכָ֗ה וְנַעְבְּרָה֙ אֶל־מַצַּ֣ב פְּלִשְׁתִּ֔ים אֲשֶׁ֖ר מֵעֵ֣בֶר הַלָּ֑ז וּלְאָבִ֖יו לֹ֥א הִגִּֽיד׃ ,וַיְהִ֣י הַיֹּ֗ום ,הַיֹּ֗ום ,Time
20470,456230,1_Samuel 18:10,wayehi_x,וַיְהִ֣י מִֽמָּחֳרָ֗ת וַתִּצְלַ֣ח רוּחַ֩ אֱלֹהִ֨ים׀ רָעָ֤ה׀ אֶל־שָׁאוּל֙ וַיִּתְנַבֵּ֣א בְתֹוךְ־הַבַּ֔יִת וְדָוִ֛ד מְנַגֵּ֥ן בְּיָדֹ֖ו כְּיֹ֣ום׀ בְּיֹ֑ום וְהַחֲנִ֖ית בְּיַד־שָׁאֽוּל׃ ,וַיְהִ֣י מִֽמָּחֳרָ֗ת ,מִֽמָּחֳרָ֗ת ,Time
20473,456590,1_Samuel 20:27,wayehi_x,וַיְהִ֗י מִֽמָּחֳרַ֤ת הַחֹ֨דֶשׁ֙ הַשֵּׁנִ֔י וַיִּפָּקֵ֖ד מְקֹ֣ום דָּוִ֑ד ס וַיֹּ֤אמֶר שָׁאוּל֙ אֶל־יְהֹונָתָ֣ן בְּנֹ֔ו מַדּ֜וּעַ לֹא־בָ֧א בֶן־יִשַׁ֛י גַּם־תְּמֹ֥ול גַּם־הַיֹּ֖ום אֶל־הַלָּֽחֶם׃ ,וַיְהִ֗י מִֽמָּחֳרַ֤ת הַחֹ֨דֶשׁ֙ הַשֵּׁנִ֔י ,מִֽמָּחֳרַ֤ת הַחֹ֨דֶשׁ֙ הַשֵּׁנִ֔י ,Time
20475,457031,1_Samuel 24:6,wayehi_x,וַֽיְהִי֙ אַֽחֲרֵי־כֵ֔ן וַיַּ֥ךְ לֵב־דָּוִ֖ד אֹתֹ֑ו עַ֚ל אֲשֶׁ֣ר כָּרַ֔ת אֶת־כָּנָ֖ף אֲשֶׁ֥ר לְשָׁאֽוּל׃ ס ,וַֽיְהִי֙ אַֽחֲרֵי־כֵ֔ן ,אַֽחֲרֵי־כֵ֔ן ,Time
20477,457328,1_Samuel 25:38,wayehi_x,וַיְהִ֖י כַּעֲשֶׂ֣רֶת הַיָּמִ֑ים וַיִּגֹּ֧ף יְהוָ֛ה אֶת־נָבָ֖ל וַיָּמֹֽת׃ ,וַיְהִ֖י כַּעֲשֶׂ֣רֶת הַיָּמִ֑ים ,כַּעֲשֶׂ֣רֶת הַיָּמִ֑ים ,Time
20481,457933,1_Samuel 31:8,wayehi_x,וַֽיְהִי֙ מִֽמָּחֳרָ֔ת וַיָּבֹ֣אוּ פְלִשְׁתִּ֔ים לְפַשֵּׁ֖ט אֶת־הַחֲלָלִ֑ים וַֽיִּמְצְא֤וּ אֶת־שָׁאוּל֙ וְאֶת־שְׁלֹ֣שֶׁת בָּנָ֔יו נֹפְלִ֖ים בְּהַ֥ר הַגִּלְבֹּֽעַ׃ ,וַֽיְהִי֙ מִֽמָּחֳרָ֔ת ,מִֽמָּחֳרָ֔ת ,Time
20482,457954,2_Samuel 1:1,wayehi_x,וַיְהִ֗י אַֽחֲרֵי֙ מֹ֣ות שָׁא֔וּל וְדָוִ֣ד שָׁ֔ב מֵהַכֹּ֖ות אֶת־הָעֲמָלֵ֑ק וַיֵּ֧שֶׁב דָּוִ֛ד בְּצִקְלָ֖ג יָמִ֥ים שְׁנָֽיִם׃ ,וַיְהִ֗י אַֽחֲרֵי֙ מֹ֣ות שָׁא֔וּל ,אַֽחֲרֵי֙ מֹ֣ות שָׁא֔וּל ,Time
20484,458073,2_Samuel 2:1,wayehi_x,וַיְהִ֣י אַֽחֲרֵי־כֵ֗ן וַיִּשְׁאַל֩ דָּוִ֨ד בַּֽיהוָ֤ה׀ לֵאמֹר֙ הַאֶעֱלֶ֗ה בְּאַחַת֙ עָרֵ֣י יְהוּדָ֔ה וַיֹּ֧אמֶר יְהוָ֛ה אֵלָ֖יו עֲלֵ֑ה וַיֹּ֧אמֶר דָּוִ֛ד אָ֥נָה אֶעֱלֶ֖ה וַיֹּ֥אמֶר חֶבְרֹֽנָה׃ ,וַיְהִ֣י אַֽחֲרֵי־כֵ֗ן ,אַֽחֲרֵי־כֵ֗ן ,Time
20488,458752,2_Samuel 8:1,wayehi_x,וַֽיְהִי֙ אַֽחֲרֵי־כֵ֔ן וַיַּ֥ךְ דָּוִ֛ד אֶת־פְּלִשְׁתִּ֖ים וַיַּכְנִיעֵ֑ם וַיִּקַּ֥ח דָּוִ֛ד אֶת־מֶ֥תֶג הָאַמָּ֖ה מִיַּ֥ד פְּלִשְׁתִּֽים׃ ,וַֽיְהִי֙ אַֽחֲרֵי־כֵ֔ן ,אַֽחֲרֵי־כֵ֔ן ,Time
20490,458870,2_Samuel 10:1,wayehi_x,וַֽיְהִי֙ אַֽחֲרֵי־כֵ֔ן וַיָּ֕מָת מֶ֖לֶךְ בְּנֵ֣י עַמֹּ֑ון וַיִּמְלֹ֛ךְ חָנ֥וּן בְּנֹ֖ו תַּחְתָּֽיו׃ ,וַֽיְהִי֙ אַֽחֲרֵי־כֵ֔ן ,אַֽחֲרֵי־כֵ֔ן ,Time
20491,458961,2_Samuel 11:1,wayehi_x,וַיְהִי֩ לִתְשׁוּבַ֨ת הַשָּׁנָ֜ה לְעֵ֣ת׀ צֵ֣את הַמַּלְאֿכִ֗ים וַיִּשְׁלַ֣ח דָּוִ֡ד אֶת־יֹואָב֩ וְאֶת־עֲבָדָ֨יו עִמֹּ֜ו וְאֶת־כָּל־יִשְׂרָאֵ֗ל וַיַּשְׁחִ֨תוּ֙ אֶת־בְּנֵ֣י עַמֹּ֔ון וַיָּצֻ֖רוּ עַל־רַבָּ֑ה וְדָוִ֖ד יֹושֵׁ֥ב בִּירוּשָׁלִָֽם׃ ס ,וַיְהִי֩ לִתְשׁוּבַ֨ת הַשָּׁנָ֜ה לְעֵ֣ת׀ ,לִתְשׁוּבַ֨ת הַשָּׁנָ֜ה לְעֵ֣ת׀ ,Time
20492,458967,2_Samuel 11:2,wayehi_x,וַיְהִ֣י׀ לְעֵ֣ת הָעֶ֗רֶב וַיָּ֨קָם דָּוִ֜ד מֵעַ֤ל מִשְׁכָּבֹו֙ וַיִּתְהַלֵּךְ֙ עַל־גַּ֣ג בֵּית־הַמֶּ֔לֶךְ וַיַּ֥רְא אִשָּׁ֛ה רֹחֶ֖צֶת מֵעַ֣ל הַגָּ֑ג וְהָ֣אִשָּׁ֔ה טֹובַ֥ת מַרְאֶ֖ה מְאֹֽד׃ ,וַיְהִ֣י׀ לְעֵ֣ת הָעֶ֗רֶב ,לְעֵ֣ת הָעֶ֗רֶב ,Time
20495,459259,2_Samuel 13:1,wayehi_x,וַיְהִ֣י אַֽחֲרֵי־כֵ֗ן וּלְאַבְשָׁלֹ֧ום בֶּן־דָּוִ֛ד אָחֹ֥ות יָפָ֖ה וּשְׁמָ֣הּ תָּמָ֑ר וַיֶּאֱהָבֶ֖הָ אַמְנֹ֥ון בֶּן־דָּוִֽד׃ ,וַיְהִ֣י אַֽחֲרֵי־כֵ֗ן ,אַֽחֲרֵי־כֵ֗ן ,Time
20496,459386,2_Samuel 13:23,wayehi_x,וַֽיְהִי֙ לִשְׁנָתַ֣יִם יָמִ֔ים וַיִּהְי֤וּ גֹֽזְזִים֙ לְאַבְשָׁלֹ֔ום בְּבַ֥עַל חָצֹ֖ור אֲשֶׁ֣ר עִם־אֶפְרָ֑יִם וַיִּקְרָ֥א אַבְשָׁלֹ֖ום לְכָל־בְּנֵ֥י הַמֶּֽלֶךְ׃ ,וַֽיְהִי֙ לִשְׁנָתַ֣יִם יָמִ֔ים ,לִשְׁנָתַ֣יִם יָמִ֔ים ,Time
20497,459663,2_Samuel 15:1,wayehi_x,וַֽיְהִי֙ מֵאַ֣חֲרֵי כֵ֔ן וַיַּ֤עַשׂ לֹו֙ אַבְשָׁלֹ֔ום מֶרְכָּבָ֖ה וְסֻסִ֑ים וַחֲמִשִּׁ֥ים אִ֖ישׁ רָצִ֥ים לְפָנָֽיו׃ ,וַֽיְהִי֙ מֵאַ֣חֲרֵי כֵ֔ן ,מֵאַ֣חֲרֵי כֵ֔ן ,Time
20498,459695,2_Samuel 15:7,wayehi_x,וַיְהִ֕י מִקֵּ֖ץ אַרְבָּעִ֣ים שָׁנָ֑ה וַיֹּ֤אמֶר אַבְשָׁלֹום֙ אֶל־הַמֶּ֔לֶךְ אֵ֣לֲכָה נָּ֗א וַאֲשַׁלֵּ֛ם אֶת־נִדְרִ֛י אֲשֶׁר־נָדַ֥רְתִּי לַֽיהוָ֖ה בְּחֶבְרֹֽון׃ ,וַיְהִ֕י מִקֵּ֖ץ אַרְבָּעִ֣ים שָׁנָ֑ה ,מִקֵּ֖ץ אַרְבָּעִ֣ים שָׁנָ֑ה ,Time
20500,460729,2_Samuel 21:18,wayehi_x,וַֽיְהִי֙ אַֽחֲרֵי־כֵ֔ן וַתְּהִי־עֹ֧וד הַמִּלְחָמָ֛ה בְּגֹ֖וב עִם־פְּלִשְׁתִּ֑ים אָ֣ז הִכָּ֗ה סִבְּכַי֙ הַחֻ֣שָׁתִ֔י אֶת־סַ֕ף אֲשֶׁ֖ר בִּילִדֵ֥י הָרָפָֽה׃ פ ,וַֽיְהִי֙ אַֽחֲרֵי־כֵ֔ן ,אַֽחֲרֵי־כֵ֔ן ,Time
20502,461564,1_Kings 2:39,wayehi_x,וַיְהִ֗י מִקֵּץ֙ שָׁלֹ֣שׁ שָׁנִ֔ים וַיִּבְרְח֤וּ שְׁנֵֽי־עֲבָדִים֙ לְשִׁמְעִ֔י אֶל־אָכִ֥ישׁ בֶּֽן־מַעֲכָ֖ה מֶ֣לֶךְ גַּ֑ת וַיַּגִּ֤ידוּ לְשִׁמְעִי֙ לֵאמֹ֔ר הִנֵּ֥ה עֲבָדֶ֖יךָ בְּגַֽת׃ ,וַיְהִ֗י מִקֵּץ֙ שָׁלֹ֣שׁ שָׁנִ֔ים ,מִקֵּץ֙ שָׁלֹ֣שׁ שָׁנִ֔ים ,Time
20509,462527,1_Kings 9:10,wayehi_x,וַיְהִ֗י מִקְצֵה֙ עֶשְׂרִ֣ים שָׁנָ֔ה אֲשֶׁר־בָּנָ֥ה שְׁלֹמֹ֖ה אֶת־שְׁנֵ֣י הַבָּתִּ֑ים אֶת־בֵּ֥ית יְהוָ֖ה וְאֶת־בֵּ֥ית הַמֶּֽלֶךְ׃ ,וַיְהִ֗י מִקְצֵה֙ עֶשְׂרִ֣ים שָׁנָ֔ה ,מִקְצֵה֙ עֶשְׂרִ֣ים שָׁנָ֔ה ,Time
20511,462686,1_Kings 11:4,wayehi_x,וַיְהִ֗י לְעֵת֙ זִקְנַ֣ת שְׁלֹמֹ֔ה נָשָׁיו֙ הִטּ֣וּ אֶת־לְבָבֹ֔ו אַחֲרֵ֖י אֱלֹהִ֣ים אֲחֵרִ֑ים וְלֹא־הָיָ֨ה לְבָבֹ֤ו שָׁלֵם֙ עִם־יְהוָ֣ה אֱלֹהָ֔יו כִּלְבַ֖ב דָּוִ֥יד אָבִֽיו׃ ,וַיְהִ֗י לְעֵת֙ זִקְנַ֣ת שְׁלֹמֹ֔ה ,לְעֵת֙ זִקְנַ֣ת שְׁלֹמֹ֔ה ,Time
20521,463607,1_Kings 17:7,wayehi_x,וַיְהִ֛י מִקֵּ֥ץ יָמִ֖ים וַיִּיבַ֣שׁ הַנָּ֑חַל כִּ֛י לֹֽא־הָיָ֥ה גֶ֖שֶׁם בָּאָֽרֶץ׃ ס ,וַיְהִ֛י מִקֵּ֥ץ יָמִ֖ים ,מִקֵּ֥ץ יָמִ֖ים ,Time
20524,463699,1_Kings 18:1,wayehi_x,וַיְהִי֙ יָמִ֣ים רַבִּ֔ים וּדְבַר־יְהוָ֗ה הָיָה֙ אֶל־אֵ֣לִיָּ֔הוּ בַּשָּׁנָ֥ה הַשְּׁלִישִׁ֖ית לֵאמֹ֑ר לֵ֚ךְ הֵרָאֵ֣ה אֶל־אַחְאָ֔ב וְאֶתְּנָ֥ה מָטָ֖ר עַל־פְּנֵ֥י הָאֲדָמָֽה׃ ,וַיְהִי֙ יָמִ֣ים רַבִּ֔ים ,יָמִ֣ים רַבִּ֔ים ,Time
20529,464229,1_Kings 20:26,wayehi_x,וַֽיְהִי֙ לִתְשׁוּבַ֣ת הַשָּׁנָ֔ה וַיִּפְקֹ֥ד בֶּן־הֲדַ֖ד אֶת־אֲרָ֑ם וַיַּ֣עַל אֲפֵ֔קָה לַמִּלְחָמָ֖ה עִם־יִשְׂרָאֵֽל׃ ,וַֽיְהִי֙ לִתְשׁוּבַ֣ת הַשָּׁנָ֔ה ,לִתְשׁוּבַ֣ת הַשָּׁנָ֔ה ,Time
20535,465017,2_Kings 3:5,wayehi_x,וַיְהִ֖י כְּמֹ֣ות אַחְאָ֑ב וַיִּפְשַׁ֥ע מֶֽלֶךְ־מֹואָ֖ב בְּמֶ֥לֶךְ יִשְׂרָאֵֽל׃ ,וַיְהִ֖י כְּמֹ֣ות אַחְאָ֑ב ,כְּמֹ֣ות אַחְאָ֑ב ,Time
20538,465173,2_Kings 4:8,wayehi_x,וַיְהִ֨י הַיֹּ֜ום וַיַּעֲבֹ֧ר אֱלִישָׁ֣ע אֶל־שׁוּנֵ֗ם וְשָׁם֙ אִשָּׁ֣ה גְדֹולָ֔ה וַתַּחֲזֶק־בֹּ֖ו לֶאֱכָל־לָ֑חֶם וַֽיְהִי֙ מִדֵּ֣י עָבְרֹ֔ו יָסֻ֥ר שָׁ֖מָּה לֶאֱכָל־לָֽחֶם׃ ,וַיְהִ֨י הַיֹּ֜ום ,הַיֹּ֜ום ,Time
20539,465192,2_Kings 4:11,wayehi_x,וַיְהִ֥י הַיֹּ֖ום וַיָּ֣בֹא שָׁ֑מָּה וַיָּ֥סַר אֶל־הָעֲלִיָּ֖ה וַיִּשְׁכַּב־שָֽׁמָּה׃ ,וַיְהִ֥י הַיֹּ֖ום ,הַיֹּ֖ום ,Time
20540,465229,2_Kings 4:18,wayehi_x,וַיִּגְדַּ֖ל הַיָּ֑לֶד וַיְהִ֣י הַיֹּ֔ום וַיֵּצֵ֥א אֶל־אָבִ֖יו אֶל־הַקֹּצְרִֽים׃ ,וַיְהִ֣י הַיֹּ֔ום ,הַיֹּ֔ום ,Time
20541,465690,2_Kings 6:24,wayehi_x,וַֽיְהִי֙ אַחֲרֵי־כֵ֔ן וַיִּקְבֹּ֛ץ בֶּן־הֲדַ֥ד מֶֽלֶךְ־אֲרָ֖ם אֶת־כָּל־מַחֲנֵ֑הוּ וַיַּ֕עַל וַיָּ֖צַר עַל־שֹׁמְרֹֽון׃ ,וַֽיְהִי֙ אַחֲרֵי־כֵ֔ן ,אַחֲרֵי־כֵ֔ן ,Time
20544,465905,2_Kings 8:3,wayehi_x,וַיְהִ֗י מִקְצֵה֙ שֶׁ֣בַע שָׁנִ֔ים וַתָּ֥שָׁב הָאִשָּׁ֖ה מֵאֶ֣רֶץ פְּלִשְׁתִּ֑ים וַתֵּצֵא֙ לִצְעֹ֣ק אֶל־הַמֶּ֔לֶךְ אֶל־בֵּיתָ֖הּ וְאֶל־שָׂדָֽהּ׃ ,וַיְהִ֗י מִקְצֵה֙ שֶׁ֣בַע שָׁנִ֔ים ,מִקְצֵה֙ שֶׁ֣בַע שָׁנִ֔ים ,Time
20545,465984,2_Kings 8:15,wayehi_x,וַיְהִ֣י מִֽמָּחֳרָ֗ת וַיִּקַּ֤ח הַמַּכְבֵּר֙ וַיִּטְבֹּ֣ל בַּמַּ֔יִם וַיִּפְרֹ֥שׂ עַל־פָּנָ֖יו וַיָּמֹ֑ת וַיִּמְלֹ֥ךְ חֲזָהאֵ֖ל תַּחְתָּֽיו׃ פ ,וַיְהִ֣י מִֽמָּחֳרָ֗ת ,מִֽמָּחֳרָ֗ת ,Time
20565,475351,Jeremiah 13:6,wayehi_x,וַיְהִ֕י מִקֵּ֖ץ יָמִ֣ים רַבִּ֑ים וַיֹּ֨אמֶר יְהוָ֜ה אֵלַ֗י ק֚וּם לֵ֣ךְ פְּרָ֔תָה וְקַ֤ח מִשָּׁם֙ אֶת־הָ֣אֵזֹ֔ור אֲשֶׁ֥ר צִוִּיתִ֖יךָ לְטָמְנֹו־שָֽׁם׃ ,וַיְהִ֕י מִקֵּ֖ץ יָמִ֣ים רַבִּ֑ים ,מִקֵּ֖ץ יָמִ֣ים רַבִּ֑ים ,Time
20569,476080,Jeremiah 20:3,wayehi_x,וַֽיְהִי֙ מִֽמָּחֳרָ֔ת וַיֹּצֵ֥א פַשְׁח֛וּר אֶֽת־יִרְמְיָ֖הוּ מִן־הַמַּהְפָּ֑כֶת וַיֹּ֨אמֶר אֵלָ֜יו יִרְמְיָ֗הוּ לֹ֤א פַשְׁחוּר֙ קָרָ֤א יְהוָה֙ שְׁמֶ֔ךָ כִּ֖י אִם־מָגֹ֥ור מִסָּבִֽיב׃ פ ,וַֽיְהִי֙ מִֽמָּחֳרָ֔ת ,מִֽמָּחֳרָ֔ת ,Time
20586,478563,Jeremiah 42:7,wayehi_x,וַיְהִ֕י מִקֵּ֖ץ עֲשֶׂ֣רֶת יָמִ֑ים וַיְהִ֥י דְבַר־יְהוָ֖ה אֶֽל־יִרְמְיָֽהוּ׃ ,וַיְהִ֕י מִקֵּ֖ץ עֲשֶׂ֣רֶת יָמִ֑ים ,מִקֵּ֖ץ עֲשֶׂ֣רֶת יָמִ֑ים ,Time
20591,480246,Ezekiel 3:16,wayehi_x,וַיְהִ֕י מִקְצֵ֖ה שִׁבְעַ֣ת יָמִ֑ים פ וַיְהִ֥י דְבַר־יְהוָ֖ה אֵלַ֥י לֵאמֹֽר׃ ,וַיְהִ֕י מִקְצֵ֖ה שִׁבְעַ֣ת יָמִ֑ים פ ,מִקְצֵ֖ה שִׁבְעַ֣ת יָמִ֑ים פ ,Time
20607,481513,Ezekiel 16:23,wayehi_x,וַיְהִ֕י אַחֲרֵ֖י כָּל־רָעָתֵ֑ךְ אֹ֣וי אֹ֣וי לָ֔ךְ נְאֻ֖ם אֲדֹנָ֥י יְהוִֽה׃ ,וַיְהִ֕י אַחֲרֵ֖י כָּל־רָעָתֵ֑ךְ ,אַחֲרֵ֖י כָּל־רָעָתֵ֑ךְ ,Time
20737,459615,2_Samuel 14:26,wehaya_x,וּֽבְגַלְּחֹו֮ אֶת־רֹאשֹׁו֒ וְֽ֠הָיָה מִקֵּץ֙ יָמִ֤ים׀ לַיָּמִים֙ אֲשֶׁ֣ר יְגַלֵּ֔חַ כִּֽי־כָבֵ֥ד עָלָ֖יו וְגִלְּחֹ֑ו וְשָׁקַל֙ אֶת־שְׂעַ֣ר רֹאשֹׁ֔ו מָאתַ֥יִם שְׁקָלִ֖ים בְּאֶ֥בֶן הַמֶּֽלֶךְ׃ ,וְֽ֠הָיָה מִקֵּץ֙ יָמִ֤ים׀ לַיָּמִים֙ ,מִקֵּץ֙ יָמִ֤ים׀ לַיָּמִים֙ ,Time
20754,469819,Isaiah 23:17,wehaya_x,וְהָיָ֞ה מִקֵּ֣ץ׀ שִׁבְעִ֣ים שָׁנָ֗ה יִפְקֹ֤ד יְהוָה֙ אֶת־צֹ֔ר וְשָׁבָ֖ה לְאֶתְנַנָּ֑ה וְזָֽנְתָ֛ה אֶת־כָּל־מַמְלְכֹ֥ות הָאָ֖רֶץ עַל־פְּנֵ֥י הָאֲדָמָֽה׃ ,וְהָיָ֞ה מִקֵּ֣ץ׀ שִׁבְעִ֣ים שָׁנָ֗ה ,מִקֵּ֣ץ׀ שִׁבְעִ֣ים שָׁנָ֗ה ,Time
20787,486571,Joel 3:1,wehaya_x,וְהָיָ֣ה אַֽחֲרֵי־כֵ֗ן אֶשְׁפֹּ֤וךְ אֶת־רוּחִי֙ עַל־כָּל־בָּשָׂ֔ר וְנִבְּא֖וּ בְּנֵיכֶ֣ם וּבְנֹֽותֵיכֶ֑ם זִקְנֵיכֶם֙ חֲלֹמֹ֣ות יַחֲלֹמ֔וּן בַּח֣וּרֵיכֶ֔ם חֶזְיֹנֹ֖ות יִרְאֽוּ׃ ,וְהָיָ֣ה אַֽחֲרֵי־כֵ֗ן ,אַֽחֲרֵי־כֵ֗ן ,Time
43,428260,Genesis 8:22,x_clause,עֹ֖ד כָּל־יְמֵ֣י הָאָ֑רֶץ זֶ֡רַע וְ֠קָצִיר וְקֹ֨ר וָחֹ֜ם וְקַ֧יִץ וָחֹ֛רֶף וְיֹ֥ום וָלַ֖יְלָה לֹ֥א יִשְׁבֹּֽתוּ׃ ,עֹ֖ד כָּל־יְמֵ֣י הָאָ֑רֶץ זֶ֡רַע וְ֠קָצִיר וְקֹ֨ר וָחֹ֜ם וְקַ֧יִץ וָחֹ֛רֶף וְיֹ֥ום וָלַ֖יְלָה לֹ֥א יִשְׁבֹּֽתוּ׃ ,כָּל־יְמֵ֣י הָאָ֑רֶץ ,Time
57,428651,Genesis 14:4,x_clause,שְׁתֵּ֤ים עֶשְׂרֵה֙ שָׁנָ֔ה עָבְד֖וּ אֶת־כְּדָרְלָעֹ֑מֶר וּשְׁלֹשׁ־עֶשְׂרֵ֥ה שָׁנָ֖ה מָרָֽדוּ׃ ,שְׁתֵּ֤ים עֶשְׂרֵה֙ שָׁנָ֔ה עָבְד֖וּ אֶת־כְּדָרְלָעֹ֑מֶר ,שְׁתֵּ֤ים עֶשְׂרֵה֙ שָׁנָ֔ה ,Time
58,428652,Genesis 14:4,x_clause,שְׁתֵּ֤ים עֶשְׂרֵה֙ שָׁנָ֔ה עָבְד֖וּ אֶת־כְּדָרְלָעֹ֑מֶר וּשְׁלֹשׁ־עֶשְׂרֵ֥ה שָׁנָ֖ה מָרָֽדוּ׃ ,וּשְׁלֹשׁ־עֶשְׂרֵ֥ה שָׁנָ֖ה מָרָֽדוּ׃ ,שְׁלֹשׁ־עֶשְׂרֵ֥ה שָׁנָ֖ה ,Time
77,429008,Genesis 18:14,x_clause,הֲיִפָּלֵ֥א מֵיְהוָ֖ה דָּבָ֑ר לַמֹּועֵ֞ד אָשׁ֥וּב אֵלֶ֛יךָ כָּעֵ֥ת חַיָּ֖ה וּלְשָׂרָ֥ה בֵֽן׃ ,לַמֹּועֵ֞ד אָשׁ֥וּב אֵלֶ֛יךָ כָּעֵ֥ת חַיָּ֖ה ,לַמֹּועֵ֞ד ,Time
192,434388,Exodus 8:19,x_clause,וְשַׂמְתִּ֣י פְדֻ֔ת בֵּ֥ין עַמִּ֖י וּבֵ֣ין עַמֶּ֑ךָ לְמָחָ֥ר יִהְיֶ֖ה הָאֹ֥ת הַזֶּֽה׃ ,לְמָחָ֥ר יִהְיֶ֖ה הָאֹ֥ת הַזֶּֽה׃ ,לְמָחָ֥ר ,Time
201,434635,Exodus 10:14,x_clause,וַיַּ֣עַל הָֽאַרְבֶּ֗ה עַ֚ל כָּל־אֶ֣רֶץ מִצְרַ֔יִם וַיָּ֕נַח בְּכֹ֖ל גְּב֣וּל מִצְרָ֑יִם כָּבֵ֣ד מְאֹ֔ד לְ֠פָנָיו לֹא־הָ֨יָה כֵ֤ן אַרְבֶּה֙ כָּמֹ֔הוּ וְאַחֲרָ֖יו לֹ֥א יִֽהְיֶה־כֵּֽן׃ ,לְ֠פָנָיו לֹא־הָ֨יָה כֵ֤ן אַרְבֶּה֙ כָּמֹ֔הוּ ,לְ֠פָנָיו ,Time
206,434785,Exodus 12:15,x_clause,שִׁבְעַ֤ת יָמִים֙ מַצֹּ֣ות תֹּאכֵ֔לוּ אַ֚ךְ בַּיֹּ֣ום הָרִאשֹׁ֔ון תַּשְׁבִּ֥יתוּ שְּׂאֹ֖ר מִבָּתֵּיכֶ֑ם כִּ֣י׀ כָּל־אֹכֵ֣ל חָמֵ֗ץ וְנִכְרְתָ֞ה הַנֶּ֤פֶשׁ הַהִוא֙ מִיִּשְׂרָאֵ֔ל מִיֹּ֥ום הָרִאשֹׁ֖ן עַד־יֹ֥ום הַשְּׁבִעִֽי׃ ,שִׁבְעַ֤ת יָמִים֙ מַצֹּ֣ות תֹּאכֵ֔לוּ ,שִׁבְעַ֤ת יָמִים֙ ,Time
212,434799,Exodus 12:19,x_clause,שִׁבְעַ֣ת יָמִ֔ים שְׂאֹ֕ר לֹ֥א יִמָּצֵ֖א בְּבָתֵּיכֶ֑ם כִּ֣י׀ כָּל־אֹכֵ֣ל מַחְמֶ֗צֶת וְנִכְרְתָ֞ה הַנֶּ֤פֶשׁ הַהִוא֙ מֵעֲדַ֣ת יִשְׂרָאֵ֔ל בַּגֵּ֖ר וּבְאֶזְרַ֥ח הָאָֽרֶץ׃ ,שִׁבְעַ֣ת יָמִ֔ים שְׂאֹ֕ר לֹ֥א יִמָּצֵ֖א בְּבָתֵּיכֶ֑ם ,שִׁבְעַ֣ת יָמִ֔ים ,Time
222,434937,Exodus 13:6,x_clause,שִׁבְעַ֥ת יָמִ֖ים תֹּאכַ֣ל מַצֹּ֑ת וּבַיֹּום֙ הַשְּׁבִיעִ֔י חַ֖ג לַיהוָֽה׃ ,שִׁבְעַ֥ת יָמִ֖ים תֹּאכַ֣ל מַצֹּ֑ת ,שִׁבְעַ֥ת יָמִ֖ים ,Time
239,435295,Exodus 16:12,x_clause,שָׁמַ֗עְתִּי אֶת־תְּלוּנֹּת֮ בְּנֵ֣י יִשְׂרָאֵל֒ דַּבֵּ֨ר אֲלֵהֶ֜ם לֵאמֹ֗ר בֵּ֤ין הָֽעַרְבַּ֨יִם֙ תֹּאכְל֣וּ בָשָׂ֔ר וּבַבֹּ֖קֶר תִּשְׂבְּעוּ־לָ֑חֶם וִֽידַעְתֶּ֕ם כִּ֛י אֲנִ֥י יְהוָ֖ה אֱלֹהֵיכֶֽם׃ ,בֵּ֤ין הָֽעַרְבַּ֨יִם֙ תֹּאכְל֣וּ בָשָׂ֔ר ,בֵּ֤ין הָֽעַרְבַּ֨יִם֙ ,Time
243,435366,Exodus 16:25,x_clause,וַיֹּ֤אמֶר מֹשֶׁה֙ אִכְלֻ֣הוּ הַיֹּ֔ום כִּֽי־שַׁבָּ֥ת הַיֹּ֖ום לַיהוָ֑ה הַיֹּ֕ום לֹ֥א תִמְצָאֻ֖הוּ בַּשָּׂדֶֽה׃ ,הַיֹּ֕ום לֹ֥א תִמְצָאֻ֖הוּ בַּשָּׂדֶֽה׃ ,הַיֹּ֕ום ,Time
244,435367,Exodus 16:26,x_clause,שֵׁ֥שֶׁת יָמִ֖ים תִּלְקְטֻ֑הוּ וּבַיֹּ֧ום הַשְּׁבִיעִ֛י שַׁבָּ֖ת לֹ֥א יִֽהְיֶה־בֹּֽו׃ ,שֵׁ֥שֶׁת יָמִ֖ים תִּלְקְטֻ֑הוּ ,שֵׁ֥שֶׁת יָמִ֖ים ,Time
361,437084,Exodus 33:5,x_clause,וַיֹּ֨אמֶר יְהוָ֜ה אֶל־מֹשֶׁ֗ה אֱמֹ֤ר אֶל־בְּנֵֽי־יִשְׂרָאֵל֙ אַתֶּ֣ם עַם־קְשֵׁה־עֹ֔רֶף רֶ֧גַע אֶחָ֛ד אֶֽעֱלֶ֥ה בְקִרְבְּךָ֖ וְכִלִּיתִ֑יךָ וְעַתָּ֗ה הֹורֵ֤ד עֶדְיְךָ֙ מֵֽעָלֶ֔יךָ וְאֵדְעָ֖ה מָ֥ה אֶֽעֱשֶׂה־לָּֽךְ׃ ,רֶ֧גַע אֶחָ֛ד אֶֽעֱלֶ֥ה בְקִרְבְּךָ֖ ,רֶ֧גַע אֶחָ֛ד ,Time
369,437248,Exodus 34:18,x_clause,אֶת־חַ֣ג הַמַּצֹּות֮ תִּשְׁמֹר֒ שִׁבְעַ֨ת יָמִ֜ים תֹּאכַ֤ל מַצֹּות֙ אֲשֶׁ֣ר צִוִּיתִ֔ךָ לְמֹועֵ֖ד חֹ֣דֶשׁ הָאָבִ֑יב כִּ֚י בְּחֹ֣דֶשׁ הָֽאָבִ֔יב יָצָ֖אתָ מִמִּצְרָֽיִם׃ ,שִׁבְעַ֨ת יָמִ֜ים תֹּאכַ֤ל מַצֹּות֙ ,שִׁבְעַ֨ת יָמִ֜ים ,Time
374,437259,Exodus 34:21,x_clause,שֵׁ֤שֶׁת יָמִים֙ תַּעֲבֹ֔ד וּבַיֹּ֥ום הַשְּׁבִיעִ֖י תִּשְׁבֹּ֑ת בֶּחָרִ֥ישׁ וּבַקָּצִ֖יר תִּשְׁבֹּֽת׃ ,שֵׁ֤שֶׁת יָמִים֙ תַּעֲבֹ֔ד ,שֵׁ֤שֶׁת יָמִים֙ ,Time
462,438594,Leviticus 8:33,x_clause,וּמִפֶּתַח֩ אֹ֨הֶל מֹועֵ֜ד לֹ֤א תֵֽצְאוּ֙ שִׁבְעַ֣ת יָמִ֔ים עַ֚ד יֹ֣ום מְלֹ֔את יְמֵ֖י מִלֻּאֵיכֶ֑ם כִּ֚י שִׁבְעַ֣ת יָמִ֔ים יְמַלֵּ֖א אֶת־יֶדְכֶֽם׃ ,כִּ֚י שִׁבְעַ֣ת יָמִ֔ים יְמַלֵּ֖א אֶת־יֶדְכֶֽם׃ ,שִׁבְעַ֣ת יָמִ֔ים ,Time
465,438617,Leviticus 9:4,x_clause,וְשֹׁ֨ור וָאַ֜יִל לִשְׁלָמִ֗ים לִזְבֹּ֨חַ֙ לִפְנֵ֣י יְהוָ֔ה וּמִנְחָ֖ה בְּלוּלָ֣ה בַשָּׁ֑מֶן כִּ֣י הַיֹּ֔ום יְהוָ֖ה נִרְאָ֥ה אֲלֵיכֶֽם׃ ,כִּ֣י הַיֹּ֔ום יְהוָ֖ה נִרְאָ֥ה אֲלֵיכֶֽם׃ ,הַיֹּ֔ום ,Time
