,cl_node,ref,clause_type,verse_text,cl_text,target_ph,xphrase_function
4783,427870,Genesis 3:22,clause_x,וַיֹּ֣אמֶר׀ יְהוָ֣ה אֱלֹהִ֗ים הֵ֤ן הָֽאָדָם֙ הָיָה֙ כְּאַחַ֣ד מִמֶּ֔נּוּ לָדַ֖עַת טֹ֣וב וָרָ֑ע וְעַתָּ֣ה׀ פֶּן־יִשְׁלַ֣ח יָדֹ֗ו וְלָקַח֙ גַּ֚ם מֵעֵ֣ץ הַֽחַיִּ֔ים וְאָכַ֖ל וָחַ֥י לְעֹלָֽם׃ ,וָחַ֥י לְעֹלָֽם׃ ,לְעֹלָֽם׃ ,Time
4806,428066,Genesis 6:3,clause_x,וַיֹּ֣אמֶר יְהוָ֗ה לֹֽא־יָדֹ֨ון רוּחִ֤י בָֽאָדָם֙ לְעֹלָ֔ם בְּשַׁגַּ֖ם ה֣וּא בָשָׂ֑ר וְהָי֣וּ יָמָ֔יו מֵאָ֥ה וְעֶשְׂרִ֖ים שָׁנָֽה׃ ,לֹֽא־יָדֹ֨ון רוּחִ֤י בָֽאָדָם֙ לְעֹלָ֔ם ,לְעֹלָ֔ם ,Time
4836,428220,Genesis 8:10,clause_x,וַיָּ֣חֶל עֹ֔וד שִׁבְעַ֥ת יָמִ֖ים אֲחֵרִ֑ים וַיֹּ֛סֶף שַׁלַּ֥ח אֶת־הַיֹּונָ֖ה מִן־הַתֵּבָֽה׃ ,וַיָּ֣חֶל עֹ֔וד שִׁבְעַ֥ת יָמִ֖ים אֲחֵרִ֑ים ,שִׁבְעַ֥ת יָמִ֖ים אֲחֵרִ֑ים ,Time
4837,428223,Genesis 8:11,clause_x,וַתָּבֹ֨א אֵלָ֤יו הַיֹּונָה֙ לְעֵ֣ת עֶ֔רֶב וְהִנֵּ֥ה עֲלֵה־זַ֖יִת טָרָ֣ף בְּפִ֑יהָ וַיֵּ֣דַע נֹ֔חַ כִּי־קַ֥לּוּ הַמַּ֖יִם מֵעַ֥ל הָאָֽרֶץ׃ ,וַתָּבֹ֨א אֵלָ֤יו הַיֹּונָה֙ לְעֵ֣ת עֶ֔רֶב ,לְעֵ֣ת עֶ֔רֶב ,Time
4839,428227,Genesis 8:12,clause_x,וַיִּיָּ֣חֶל עֹ֔וד שִׁבְעַ֥ת יָמִ֖ים אֲחֵרִ֑ים וַיְשַׁלַּח֙ אֶת־הַיֹּונָ֔ה וְלֹֽא־יָסְפָ֥ה שׁוּב־אֵלָ֖יו עֹֽוד׃ ,וַיִּיָּ֣חֶל עֹ֔וד שִׁבְעַ֥ת יָמִ֖ים אֲחֵרִ֑ים ,שִׁבְעַ֥ת יָמִ֖ים אֲחֵרִ֑ים ,Time
4868,428448,Genesis 11:10,clause_x,אֵ֚לֶּה תֹּולְדֹ֣ת שֵׁ֔ם שֵׁ֚ם בֶּן־מְאַ֣ת שָׁנָ֔ה וַיֹּ֖ולֶד אֶת־אַרְפַּכְשָׁ֑ד שְׁנָתַ֖יִם אַחַ֥ר הַמַּבּֽוּל׃ ,וַיֹּ֖ולֶד אֶת־אַרְפַּכְשָׁ֑ד שְׁנָתַ֖יִם אַחַ֥ר הַמַּבּֽוּל׃ ,שְׁנָתַ֖יִם אַחַ֥ר הַמַּבּֽוּל׃ ,Time
4869,428467,Genesis 11:18,clause_x,וַֽיְחִי־פֶ֖לֶג שְׁלֹשִׁ֣ים שָׁנָ֑ה וַיֹּ֖ולֶד אֶת־רְעֽוּ׃ ,וַֽיְחִי־פֶ֖לֶג שְׁלֹשִׁ֣ים שָׁנָ֑ה ,שְׁלֹשִׁ֣ים שָׁנָ֑ה ,Time
4870,428477,Genesis 11:22,clause_x,וַיְחִ֥י שְׂר֖וּג שְׁלֹשִׁ֣ים שָׁנָ֑ה וַיֹּ֖ולֶד אֶת־נָחֹֽור׃ ,וַיְחִ֥י שְׂר֖וּג שְׁלֹשִׁ֣ים שָׁנָ֑ה ,שְׁלֹשִׁ֣ים שָׁנָ֑ה ,Time
4871,428487,Genesis 11:26,clause_x,וַֽיְחִי־תֶ֖רַח שִׁבְעִ֣ים שָׁנָ֑ה וַיֹּ֨ולֶד֙ אֶת־אַבְרָ֔ם אֶת־נָחֹ֖ור וְאֶת־הָרָֽן׃ ,וַֽיְחִי־תֶ֖רַח שִׁבְעִ֣ים שָׁנָ֑ה ,שִׁבְעִ֣ים שָׁנָ֑ה ,Time
4916,428781,Genesis 15:13,clause_x,וַיֹּ֣אמֶר לְאַבְרָ֗ם יָדֹ֨עַ תֵּדַ֜ע כִּי־גֵ֣ר׀ יִהְיֶ֣ה זַרְעֲךָ֗ בְּאֶ֨רֶץ֙ לֹ֣א לָהֶ֔ם וַעֲבָד֖וּם וְעִנּ֣וּ אֹתָ֑ם אַרְבַּ֥ע מֵאֹ֖ות שָׁנָֽה׃ ,וְעִנּ֣וּ אֹתָ֑ם אַרְבַּ֥ע מֵאֹ֖ות שָׁנָֽה׃ ,אַרְבַּ֥ע מֵאֹ֖ות שָׁנָֽה׃ ,Time
4920,428809,Genesis 16:3,clause_x,וַתִּקַּ֞ח שָׂרַ֣י אֵֽשֶׁת־אַבְרָ֗ם אֶת־הָגָ֤ר הַמִּצְרִית֙ שִׁפְחָתָ֔הּ מִקֵּץ֙ עֶ֣שֶׂר שָׁנִ֔ים לְשֶׁ֥בֶת אַבְרָ֖ם בְּאֶ֣רֶץ כְּנָ֑עַן וַתִּתֵּ֥ן אֹתָ֛הּ לְאַבְרָ֥ם אִישָׁ֖הּ לֹ֥ו לְאִשָּֽׁה׃ ,וַתִּקַּ֞ח שָׂרַ֣י אֵֽשֶׁת־אַבְרָ֗ם אֶת־הָגָ֤ר הַמִּצְרִית֙ שִׁפְחָתָ֔הּ מִקֵּץ֙ עֶ֣שֶׂר שָׁנִ֔ים ,מִקֵּץ֙ עֶ֣שֶׂר שָׁנִ֔ים ,Time
4955,428989,Genesis 18:10,clause_x,וַיֹּ֗אמֶר שֹׁ֣וב אָשׁ֤וּב אֵלֶ֨יךָ֙ כָּעֵ֣ת חַיָּ֔ה וְהִנֵּה־בֵ֖ן לְשָׂרָ֣ה אִשְׁתֶּ֑ךָ וְשָׂרָ֥ה שֹׁמַ֛עַת פֶּ֥תַח הָאֹ֖הֶל וְה֥וּא אַחֲרָֽיו׃ ,שֹׁ֣וב אָשׁ֤וּב אֵלֶ֨יךָ֙ כָּעֵ֣ת חַיָּ֔ה ,כָּעֵ֣ת חַיָּ֔ה ,Time
4971,429131,Genesis 19:5,clause_x,וַיִּקְרְא֤וּ אֶל־לֹוט֙ וַיֹּ֣אמְרוּ לֹ֔ו אַיֵּ֧ה הָאֲנָשִׁ֛ים אֲשֶׁר־בָּ֥אוּ אֵלֶ֖יךָ הַלָּ֑יְלָה הֹוצִיאֵ֣ם אֵלֵ֔ינוּ וְנֵדְעָ֖ה אֹתָֽם׃ ,אֲשֶׁר־בָּ֥אוּ אֵלֶ֖יךָ הַלָּ֑יְלָה ,הַלָּ֑יְלָה ,Time
4999,429287,Genesis 20:3,clause_x,וַיָּבֹ֧א אֱלֹהִ֛ים אֶל־אֲבִימֶ֖לֶךְ בַּחֲלֹ֣ום הַלָּ֑יְלָה וַיֹּ֣אמֶר לֹ֗ו הִנְּךָ֥ מֵת֙ עַל־הָאִשָּׁ֣ה אֲשֶׁר־לָקַ֔חְתָּ וְהִ֖וא בְּעֻ֥לַת בָּֽעַל׃ ,וַיָּבֹ֧א אֱלֹהִ֛ים אֶל־אֲבִימֶ֖לֶךְ בַּחֲלֹ֣ום הַלָּ֑יְלָה ,הַלָּ֑יְלָה ,Time
5012,429367,Genesis 21:2,clause_x,וַתַּהַר֩ וַתֵּ֨לֶד שָׂרָ֧ה לְאַבְרָהָ֛ם בֵּ֖ן לִזְקֻנָ֑יו לַמֹּועֵ֕ד אֲשֶׁר־דִּבֶּ֥ר אֹתֹ֖ו אֱלֹהִֽים׃ ,וַתֵּ֨לֶד שָׂרָ֧ה לְאַבְרָהָ֛ם בֵּ֖ן לִזְקֻנָ֑יו לַמֹּועֵ֕ד ,לַמֹּועֵ֕ד ,Time
5043,429481,Genesis 21:34,clause_x,וַיָּ֧גָר אַבְרָהָ֛ם בְּאֶ֥רֶץ פְּלִשְׁתִּ֖ים יָמִ֥ים רַבִּֽים׃ פ ,וַיָּ֧גָר אַבְרָהָ֛ם בְּאֶ֥רֶץ פְּלִשְׁתִּ֖ים יָמִ֥ים רַבִּֽים׃ פ ,יָמִ֥ים רַבִּֽים׃ פ ,Time
5069,429555,Genesis 22:14,clause_x,וַיִּקְרָ֧א אַבְרָהָ֛ם שֵֽׁם־הַמָּקֹ֥ום הַה֖וּא יְהוָ֣ה׀ יִרְאֶ֑ה אֲשֶׁר֙ יֵאָמֵ֣ר הַיֹּ֔ום בְּהַ֥ר יְהוָ֖ה יֵרָאֶֽה׃ ,אֲשֶׁר֙ יֵאָמֵ֣ר הַיֹּ֔ום ,הַיֹּ֔ום ,Time
5103,429699,Genesis 24:11,clause_x,וַיַּבְרֵ֧ךְ הַגְּמַלִּ֛ים מִח֥וּץ לָעִ֖יר אֶל־בְּאֵ֣ר הַמָּ֑יִם לְעֵ֣ת עֶ֔רֶב לְעֵ֖ת צֵ֥את הַשֹּׁאֲבֹֽת׃ ,וַיַּבְרֵ֧ךְ הַגְּמַלִּ֛ים מִח֥וּץ לָעִ֖יר אֶל־בְּאֵ֣ר הַמָּ֑יִם לְעֵ֣ת עֶ֔רֶב לְעֵ֖ת ,לְעֵ֣ת עֶ֔רֶב לְעֵ֖ת ,Time
5143,429912,Genesis 24:55,clause_x,וַיֹּ֤אמֶר אָחִ֨יהָ֙ וְאִמָּ֔הּ תֵּשֵׁ֨ב הַנַּעֲרָ֥ אִתָּ֛נוּ יָמִ֖ים אֹ֣ו עָשֹׂ֑ור אַחַ֖ר תֵּלֵֽךְ׃ ,תֵּשֵׁ֨ב הַנַּעֲרָ֥ אִתָּ֛נוּ יָמִ֖ים אֹ֣ו עָשֹׂ֑ור ,יָמִ֖ים אֹ֣ו עָשֹׂ֑ור ,Time
5186,430144,Genesis 26:18,clause_x,וַיָּ֨שָׁב יִצְחָ֜ק וַיַּחְפֹּ֣ר׀ אֶת־בְּאֵרֹ֣ת הַמַּ֗יִם אֲשֶׁ֤ר חָֽפְרוּ֙ בִּימֵי֙ אַבְרָהָ֣ם אָבִ֔יו וַיְסַתְּמ֣וּם פְּלִשְׁתִּ֔ים אַחֲרֵ֖י מֹ֣ות אַבְרָהָ֑ם וַיִּקְרָ֤א לָהֶן֙ שֵׁמֹ֔ות כַּשֵּׁמֹ֕ת אֲשֶׁר־קָרָ֥א לָהֶ֖ן אָבִֽיו׃ ,וַיְסַתְּמ֣וּם פְּלִשְׁתִּ֔ים אַחֲרֵ֖י מֹ֣ות אַבְרָהָ֑ם ,אַחֲרֵ֖י מֹ֣ות אַבְרָהָ֑ם ,Time
5207,430247,Genesis 27:7,clause_x,הָבִ֨יאָה לִּ֥י צַ֛יִד וַעֲשֵׂה־לִ֥י מַטְעַמִּ֖ים וְאֹכֵ֑לָה וַאֲבָרֶכְכָ֛ה לִפְנֵ֥י יְהוָ֖ה לִפְנֵ֥י מֹותִֽי׃ ,וַאֲבָרֶכְכָ֛ה לִפְנֵ֥י יְהוָ֖ה לִפְנֵ֥י מֹותִֽי׃ ,לִפְנֵ֥י מֹותִֽי׃ ,Time
5210,430258,Genesis 27:10,clause_x,וְהֵבֵאתָ֥ לְאָבִ֖יךָ וְאָכָ֑ל בַּעֲבֻ֛ר אֲשֶׁ֥ר יְבָרֶכְךָ֖ לִפְנֵ֥י מֹותֹֽו׃ ,בַּעֲבֻ֛ר אֲשֶׁ֥ר יְבָרֶכְךָ֖ לִפְנֵ֥י מֹותֹֽו׃ ,לִפְנֵ֥י מֹותֹֽו׃ ,Time
5243,430433,Genesis 27:44,clause_x,וְיָשַׁבְתָּ֥ עִמֹּ֖ו יָמִ֣ים אֲחָדִ֑ים עַ֥ד אֲשֶׁר־תָּשׁ֖וּב חֲמַ֥ת אָחִֽיךָ׃ ,וְיָשַׁבְתָּ֥ עִמֹּ֖ו יָמִ֣ים אֲחָדִ֑ים ,יָמִ֣ים אֲחָדִ֑ים ,Time
5245,430440,Genesis 27:45,clause_x,עַד־שׁ֨וּב אַף־אָחִ֜יךָ מִמְּךָ֗ וְשָׁכַח֙ אֵ֣ת אֲשֶׁר־עָשִׂ֣יתָ לֹּ֔ו וְשָׁלַחְתִּ֖י וּלְקַחְתִּ֣יךָ מִשָּׁ֑ם לָמָ֥ה אֶשְׁכַּ֛ל גַּם־שְׁנֵיכֶ֖ם יֹ֥ום אֶחָֽד׃ ,לָמָ֥ה אֶשְׁכַּ֛ל גַּם־שְׁנֵיכֶ֖ם יֹ֥ום אֶחָֽד׃ ,יֹ֥ום אֶחָֽד׃ ,Time
5278,430602,Genesis 29:14,clause_x,וַיֹּ֤אמֶר לֹו֙ לָבָ֔ן אַ֛ךְ עַצְמִ֥י וּבְשָׂרִ֖י אָ֑תָּה וַיֵּ֥שֶׁב עִמֹּ֖ו חֹ֥דֶשׁ יָמִֽים׃ ,וַיֵּ֥שֶׁב עִמֹּ֖ו חֹ֥דֶשׁ יָמִֽים׃ ,חֹ֥דֶשׁ יָמִֽים׃ ,Time
5279,430621,Genesis 29:20,clause_x,וַיַּעֲבֹ֧ד יַעֲקֹ֛ב בְּרָחֵ֖ל שֶׁ֣בַע שָׁנִ֑ים וַיִּהְי֤וּ בְעֵינָיו֙ כְּיָמִ֣ים אֲחָדִ֔ים בְּאַהֲבָתֹ֖ו אֹתָֽהּ׃ ,וַיַּעֲבֹ֧ד יַעֲקֹ֛ב בְּרָחֵ֖ל שֶׁ֣בַע שָׁנִ֑ים ,שֶׁ֣בַע שָׁנִ֑ים ,Time
5286,430646,Genesis 29:27,clause_x,מַלֵּ֖א שְׁבֻ֣עַ זֹ֑את וְנִתְּנָ֨ה לְךָ֜ גַּם־אֶת־זֹ֗את בַּעֲבֹדָה֙ אֲשֶׁ֣ר תַּעֲבֹ֣ד עִמָּדִ֔י עֹ֖וד שֶֽׁבַע־שָׁנִ֥ים אֲחֵרֹֽות׃ ,אֲשֶׁ֣ר תַּעֲבֹ֣ד עִמָּדִ֔י עֹ֖וד שֶֽׁבַע־שָׁנִ֥ים אֲחֵרֹֽות׃ ,שֶֽׁבַע־שָׁנִ֥ים אֲחֵרֹֽות׃ ,Time
5290,430655,Genesis 29:30,clause_x,וַיָּבֹא֙ גַּ֣ם אֶל־רָחֵ֔ל וַיֶּאֱהַ֥ב גַּֽם־אֶת־רָחֵ֖ל מִלֵּאָ֑ה וַיַּעֲבֹ֣ד עִמֹּ֔ו עֹ֖וד שֶֽׁבַע־שָׁנִ֥ים אֲחֵרֹֽות׃ ,וַיַּעֲבֹ֣ד עִמֹּ֔ו עֹ֖וד שֶֽׁבַע־שָׁנִ֥ים אֲחֵרֹֽות׃ ,שֶֽׁבַע־שָׁנִ֥ים אֲחֵרֹֽות׃ ,Time
5314,430797,Genesis 30:30,clause_x,כִּ֡י מְעַט֩ אֲשֶׁר־הָיָ֨ה לְךָ֤ לְפָנַי֙ וַיִּפְרֹ֣ץ לָרֹ֔ב וַיְבָ֧רֶךְ יְהוָ֛ה אֹתְךָ֖ לְרַגְלִ֑י וְעַתָּ֗ה מָתַ֛י אֶֽעֱשֶׂ֥ה גַם־אָנֹכִ֖י לְבֵיתִֽי׃ ,אֲשֶׁר־הָיָ֨ה לְךָ֤ לְפָנַי֙ ,לְפָנַי֙ ,Time
5319,430810,Genesis 30:32,clause_x,אֶֽעֱבֹ֨ר בְּכָל־צֹֽאנְךָ֜ הַיֹּ֗ום הָסֵ֨ר מִשָּׁ֜ם כָּל־שֶׂ֣ה׀ נָקֹ֣ד וְטָל֗וּא וְכָל־שֶׂה־חוּם֙ בַּכְּשָׂבִ֔ים וְטָל֥וּא וְנָקֹ֖ד בָּעִזִּ֑ים וְהָיָ֖ה שְׂכָרִֽי׃ ,אֶֽעֱבֹ֨ר בְּכָל־צֹֽאנְךָ֜ הַיֹּ֗ום ,הַיֹּ֗ום ,Time
5347,430943,Genesis 31:24,clause_x,וַיָּבֹ֧א אֱלֹהִ֛ים אֶל־לָבָ֥ן הָאֲרַמִּ֖י בַּחֲלֹ֣ם הַלָּ֑יְלָה וַיֹּ֣אמֶר לֹ֗ו הִשָּׁ֧מֶר לְךָ֛ פֶּן־תְּדַבֵּ֥ר עִֽם־יַעֲקֹ֖ב מִטֹּ֥וב עַד־רָֽע׃ ,וַיָּבֹ֧א אֱלֹהִ֛ים אֶל־לָבָ֥ן הָאֲרַמִּ֖י בַּחֲלֹ֣ם הַלָּ֑יְלָה ,הַלָּ֑יְלָה ,Time
5407,431279,Genesis 33:13,clause_x,וַיֹּ֣אמֶר אֵלָ֗יו אֲדֹנִ֤י יֹדֵ֨עַ֙ כִּֽי־הַיְלָדִ֣ים רַכִּ֔ים וְהַצֹּ֥אן וְהַבָּקָ֖ר עָלֹ֣ות עָלָ֑י וּדְפָקוּם֙ יֹ֣ום אֶחָ֔ד וָמֵ֖תוּ כָּל־הַצֹּֽאן׃ ,וּדְפָקוּם֙ יֹ֣ום אֶחָ֔ד ,יֹ֣ום אֶחָ֔ד ,Time
5499,431795,Genesis 37:34,clause_x,וַיִּקְרַ֤ע יַעֲקֹב֙ שִׂמְלֹתָ֔יו וַיָּ֥שֶׂם שַׂ֖ק בְּמָתְנָ֑יו וַיִּתְאַבֵּ֥ל עַל־בְּנֹ֖ו יָמִ֥ים רַבִּֽים׃ ,וַיִּתְאַבֵּ֥ל עַל־בְּנֹ֖ו יָמִ֥ים רַבִּֽים׃ ,יָמִ֥ים רַבִּֽים׃ ,Time
5624,432418,Genesis 42:17,clause_x,וַיֶּאֱסֹ֥ף אֹתָ֛ם אֶל־מִשְׁמָ֖ר שְׁלֹ֥שֶׁת יָמִֽים׃ ,וַיֶּאֱסֹ֥ף אֹתָ֛ם אֶל־מִשְׁמָ֖ר שְׁלֹ֥שֶׁת יָמִֽים׃ ,שְׁלֹ֥שֶׁת יָמִֽים׃ ,Time
5643,432574,Genesis 43:9,clause_x,אָֽנֹכִי֙ אֶֽעֶרְבֶ֔נּוּ מִיָּדִ֖י תְּבַקְשֶׁ֑נּוּ אִם־לֹ֨א הֲבִיאֹתִ֤יו אֵלֶ֨יךָ֙ וְהִצַּגְתִּ֣יו לְפָנֶ֔יךָ וְחָטָ֥אתִֽי לְךָ֖ כָּל־הַיָּמִֽים׃ ,וְחָטָ֥אתִֽי לְךָ֖ כָּל־הַיָּמִֽים׃ ,כָּל־הַיָּמִֽים׃ ,Time
5691,432846,Genesis 44:32,clause_x,כִּ֤י עַבְדְּךָ֙ עָרַ֣ב אֶת־הַנַּ֔עַר מֵעִ֥ם אָבִ֖י לֵאמֹ֑ר אִם־לֹ֤א אֲבִיאֶ֨נּוּ֙ אֵלֶ֔יךָ וְחָטָ֥אתִי לְאָבִ֖י כָּל־הַיָּמִֽים׃ ,וְחָטָ֥אתִי לְאָבִ֖י כָּל־הַיָּמִֽים׃ ,כָּל־הַיָּמִֽים׃ ,Time
5775,433187,Genesis 47:28,clause_x,וַיְחִ֤י יַעֲקֹב֙ בְּאֶ֣רֶץ מִצְרַ֔יִם שְׁבַ֥ע עֶשְׂרֵ֖ה שָׁנָ֑ה וַיְהִ֤י יְמֵֽי־יַעֲקֹב֙ שְׁנֵ֣י חַיָּ֔יו שֶׁ֣בַע שָׁנִ֔ים וְאַרְבָּעִ֥ים וּמְאַ֖ת שָׁנָֽה׃ ,וַיְחִ֤י יַעֲקֹב֙ בְּאֶ֣רֶץ מִצְרַ֔יִם שְׁבַ֥ע עֶשְׂרֵ֖ה שָׁנָ֑ה ,שְׁבַ֥ע עֶשְׂרֵ֖ה שָׁנָ֑ה ,Time
5818,433445,Genesis 50:3,clause_x,וַיִּמְלְאוּ־לֹו֙ אַרְבָּעִ֣ים יֹ֔ום כִּ֛י כֵּ֥ן יִמְלְא֖וּ יְמֵ֣י הַחֲנֻטִ֑ים וַיִּבְכּ֥וּ אֹתֹ֛ו מִצְרַ֖יִם שִׁבְעִ֥ים יֹֽום׃ ,וַיִּבְכּ֥וּ אֹתֹ֛ו מִצְרַ֖יִם שִׁבְעִ֥ים יֹֽום׃ ,שִׁבְעִ֥ים יֹֽום׃ ,Time
5825,433476,Genesis 50:10,clause_x,וַיָּבֹ֜אוּ עַד־גֹּ֣רֶן הָאָטָ֗ד אֲשֶׁר֙ בְּעֵ֣בֶר הַיַּרְדֵּ֔ן וַיִּ֨סְפְּדוּ־שָׁ֔ם מִסְפֵּ֛ד גָּדֹ֥ול וְכָבֵ֖ד מְאֹ֑ד וַיַּ֧עַשׂ לְאָבִ֛יו אֵ֖בֶל שִׁבְעַ֥ת יָמִֽים׃ ,וַיַּ֧עַשׂ לְאָבִ֛יו אֵ֖בֶל שִׁבְעַ֥ת יָמִֽים׃ ,שִׁבְעַ֥ת יָמִֽים׃ ,Time
5861,433617,Exodus 2:2,clause_x,וַתַּ֥הַר הָאִשָּׁ֖ה וַתֵּ֣לֶד בֵּ֑ן וַתֵּ֤רֶא אֹתֹו֙ כִּי־טֹ֣וב ה֔וּא וַֽתִּצְפְּנֵ֖הוּ שְׁלֹשָׁ֥ה יְרָחִֽים׃ ,וַֽתִּצְפְּנֵ֖הוּ שְׁלֹשָׁ֥ה יְרָחִֽים׃ ,שְׁלֹשָׁ֥ה יְרָחִֽים׃ ,Time
6050,434446,Exodus 9:6,clause_x,וַיַּ֨עַשׂ יְהוָ֜ה אֶת־הַדָּבָ֤ר הַזֶּה֙ מִֽמָּחֳרָ֔ת וַיָּ֕מָת כֹּ֖ל מִקְנֵ֣ה מִצְרָ֑יִם וּמִמִּקְנֵ֥ה בְנֵֽי־יִשְׂרָאֵ֖ל לֹא־מֵ֥ת אֶחָֽד׃ ,וַיַּ֨עַשׂ יְהוָ֜ה אֶת־הַדָּבָ֤ר הַזֶּה֙ מִֽמָּחֳרָ֔ת ,מִֽמָּחֳרָ֔ת ,Time
6115,434754,Exodus 12:6,clause_x,וְהָיָ֤ה לָכֶם֙ לְמִשְׁמֶ֔רֶת עַ֣ד אַרְבָּעָ֥ה עָשָׂ֛ר יֹ֖ום לַחֹ֣דֶשׁ הַזֶּ֑ה וְשָׁחֲט֣וּ אֹתֹ֗ו כֹּ֛ל קְהַ֥ל עֲדַֽת־יִשְׂרָאֵ֖ל בֵּ֥ין הָעַרְבָּֽיִם׃ ,וְשָׁחֲט֣וּ אֹתֹ֗ו כֹּ֛ל קְהַ֥ל עֲדַֽת־יִשְׂרָאֵ֖ל בֵּ֥ין הָעַרְבָּֽיִם׃ ,בֵּ֥ין הָעַרְבָּֽיִם׃ ,Time
6117,434763,Exodus 12:10,clause_x,וְלֹא־תֹותִ֥ירוּ מִמֶּ֖נּוּ עַד־בֹּ֑קֶר וְהַנֹּתָ֥ר מִמֶּ֛נּוּ עַד־בֹּ֖קֶר בָּאֵ֥שׁ תִּשְׂרֹֽפוּ׃ ,וְלֹא־תֹותִ֥ירוּ מִמֶּ֖נּוּ עַד־בֹּ֑קֶר ,עַד־בֹּ֑קֶר ,Time
6122,434783,Exodus 12:14,clause_x,וְהָיָה֩ הַיֹּ֨ום הַזֶּ֤ה לָכֶם֙ לְזִכָּרֹ֔ון וְחַגֹּתֶ֥ם אֹתֹ֖ו חַ֣ג לַֽיהוָ֑ה לְדֹרֹ֣תֵיכֶ֔ם חֻקַּ֥ת עֹולָ֖ם תְּחָגֻּֽהוּ׃ ,וְחַגֹּתֶ֥ם אֹתֹ֖ו חַ֣ג לַֽיהוָ֑ה לְדֹרֹ֣תֵיכֶ֔ם ,לְדֹרֹ֣תֵיכֶ֔ם ,Time
6131,434824,Exodus 12:24,clause_x,וּשְׁמַרְתֶּ֖ם אֶת־הַדָּבָ֣ר הַזֶּ֑ה לְחָק־לְךָ֥ וּלְבָנֶ֖יךָ עַד־עֹולָֽם׃ ,וּשְׁמַרְתֶּ֖ם אֶת־הַדָּבָ֣ר הַזֶּ֑ה לְחָק־לְךָ֥ וּלְבָנֶ֖יךָ עַד־עֹולָֽם׃ ,עַד־עֹולָֽם׃ ,Time
6147,434949,Exodus 13:10,clause_x,וְשָׁמַרְתָּ֛ אֶת־הַחֻקָּ֥ה הַזֹּ֖את לְמֹועֲדָ֑הּ מִיָּמִ֖ים יָמִֽימָה׃ ס ,וְשָׁמַרְתָּ֛ אֶת־הַחֻקָּ֥ה הַזֹּ֖את לְמֹועֲדָ֑הּ מִיָּמִ֖ים יָמִֽימָה׃ ס ,מִיָּמִ֖ים יָמִֽימָה׃ ס ,Time
6166,435057,Exodus 14:13,clause_x,וַיֹּ֨אמֶר מֹשֶׁ֣ה אֶל־הָעָם֮ אַל־תִּירָאוּ֒ הִֽתְיַצְב֗וּ וּרְאוּ֙ אֶת־יְשׁוּעַ֣ת יְהוָ֔ה אֲשֶׁר־יַעֲשֶׂ֥ה לָכֶ֖ם הַיֹּ֑ום כִּ֗י אֲשֶׁ֨ר רְאִיתֶ֤ם אֶת־מִצְרַ֨יִם֙ הַיֹּ֔ום לֹ֥א תֹסִ֛יפוּ לִרְאֹתָ֥ם עֹ֖וד עַד־עֹולָֽם׃ ,אֲשֶׁר־יַעֲשֶׂ֥ה לָכֶ֖ם הַיֹּ֑ום ,הַיֹּ֑ום ,Time
6167,435059,Exodus 14:13,clause_x,וַיֹּ֨אמֶר מֹשֶׁ֣ה אֶל־הָעָם֮ אַל־תִּירָאוּ֒ הִֽתְיַצְב֗וּ וּרְאוּ֙ אֶת־יְשׁוּעַ֣ת יְהוָ֔ה אֲשֶׁר־יַעֲשֶׂ֥ה לָכֶ֖ם הַיֹּ֑ום כִּ֗י אֲשֶׁ֨ר רְאִיתֶ֤ם אֶת־מִצְרַ֨יִם֙ הַיֹּ֔ום לֹ֥א תֹסִ֛יפוּ לִרְאֹתָ֥ם עֹ֖וד עַד־עֹולָֽם׃ ,אֲשֶׁ֨ר רְאִיתֶ֤ם אֶת־מִצְרַ֨יִם֙ הַיֹּ֔ום ,הַיֹּ֔ום ,Time
6174,435086,Exodus 14:20,clause_x,וַיָּבֹ֞א בֵּ֣ין׀ מַחֲנֵ֣ה מִצְרַ֗יִם וּבֵין֙ מַחֲנֵ֣ה יִשְׂרָאֵ֔ל וַיְהִ֤י הֶֽעָנָן֙ וְהַחֹ֔שֶׁךְ וַיָּ֖אֶר אֶת־הַלָּ֑יְלָה וְלֹא־קָרַ֥ב זֶ֛ה אֶל־זֶ֖ה כָּל־הַלָּֽיְלָה׃ ,וְלֹא־קָרַ֥ב זֶ֛ה אֶל־זֶ֖ה כָּל־הַלָּֽיְלָה׃ ,כָּל־הַלָּֽיְלָה׃ ,Time
6176,435088,Exodus 14:21,clause_x,וַיֵּ֨ט מֹשֶׁ֣ה אֶת־יָדֹו֮ עַל־הַיָּם֒ וַיֹּ֣ולֶךְ יְהוָ֣ה׀ אֶת־הַ֠יָּם בְּר֨וּחַ קָדִ֤ים עַזָּה֙ כָּל־הַלַּ֔יְלָה וַיָּ֥שֶׂם אֶת־הַיָּ֖ם לֶחָרָבָ֑ה וַיִּבָּקְע֖וּ הַמָּֽיִם׃ ,וַיֹּ֣ולֶךְ יְהוָ֣ה׀ אֶת־הַ֠יָּם בְּר֨וּחַ קָדִ֤ים עַזָּה֙ כָּל־הַלַּ֔יְלָה ,כָּל־הַלַּ֔יְלָה ,Time
6213,435259,Exodus 16:5,clause_x,וְהָיָה֙ בַּיֹּ֣ום הַשִּׁשִּׁ֔י וְהֵכִ֖ינוּ אֵ֣ת אֲשֶׁר־יָבִ֑יאוּ וְהָיָ֣ה מִשְׁנֶ֔ה עַ֥ל אֲשֶֽׁר־יִלְקְט֖וּ יֹ֥ום׀ יֹֽום׃ ס ,עַ֥ל אֲשֶֽׁר־יִלְקְט֖וּ יֹ֥ום׀ יֹֽום׃ ס ,יֹ֥ום׀ יֹֽום׃ ס ,Time
6226,435336,Exodus 16:19,clause_x,וַיֹּ֥אמֶר מֹשֶׁ֖ה אֲלֵהֶ֑ם אִ֕ישׁ אַל־יֹותֵ֥ר מִמֶּ֖נּוּ עַד־בֹּֽקֶר׃ ,אַל־יֹותֵ֥ר מִמֶּ֖נּוּ עַד־בֹּֽקֶר׃ ,עַד־בֹּֽקֶר׃ ,Time
6227,435338,Exodus 16:20,clause_x,וְלֹא־שָׁמְע֣וּ אֶל־מֹשֶׁ֗ה וַיֹּותִ֨רוּ אֲנָשִׁ֤ים מִמֶּ֨נּוּ֙ עַד־בֹּ֔קֶר וַיָּ֥רֻם תֹּולָעִ֖ים וַיִּבְאַ֑שׁ וַיִּקְצֹ֥ף עֲלֵהֶ֖ם מֹשֶֽׁה׃ ,וַיֹּותִ֨רוּ אֲנָשִׁ֤ים מִמֶּ֨נּוּ֙ עַד־בֹּ֔קֶר ,עַד־בֹּ֔קֶר ,Time
6231,435359,Exodus 16:24,clause_x,וַיַּנִּ֤יחוּ אֹתֹו֙ עַד־הַבֹּ֔קֶר כַּאֲשֶׁ֖ר צִוָּ֣ה מֹשֶׁ֑ה וְלֹ֣א הִבְאִ֔ישׁ וְרִמָּ֖ה לֹא־הָ֥יְתָה בֹּֽו׃ ,וַיַּנִּ֤יחוּ אֹתֹו֙ עַד־הַבֹּ֔קֶר ,עַד־הַבֹּ֔קֶר ,Time
6244,435485,Exodus 18:2,clause_x,וַיִּקַּ֗ח יִתְרֹו֙ חֹתֵ֣ן מֹשֶׁ֔ה אֶת־צִפֹּרָ֖ה אֵ֣שֶׁת מֹשֶׁ֑ה אַחַ֖ר שִׁלּוּחֶֽיהָ׃ ,וַיִּקַּ֗ח יִתְרֹו֙ חֹתֵ֣ן מֹשֶׁ֔ה אֶת־צִפֹּרָ֖ה אֵ֣שֶׁת מֹשֶׁ֑ה אַחַ֖ר שִׁלּוּחֶֽיהָ׃ ,אַחַ֖ר שִׁלּוּחֶֽיהָ׃ ,Time
6255,435529,Exodus 18:13,clause_x,וַיְהִי֙ מִֽמָּחֳרָ֔ת וַיֵּ֥שֶׁב מֹשֶׁ֖ה לִשְׁפֹּ֣ט אֶת־הָעָ֑ם וַיַּעֲמֹ֤ד הָעָם֙ עַל־מֹשֶׁ֔ה מִן־הַבֹּ֖קֶר עַד־הָעָֽרֶב׃ ,וַיַּעֲמֹ֤ד הָעָם֙ עַל־מֹשֶׁ֔ה מִן־הַבֹּ֖קֶר עַד־הָעָֽרֶב׃ ,מִן־הַבֹּ֖קֶר עַד־הָעָֽרֶב׃ ,Time
6425,436175,Exodus 24:16,clause_x,וַיִּשְׁכֹּ֤ן כְּבֹוד־יְהוָה֙ עַל־הַ֣ר סִינַ֔י וַיְכַסֵּ֥הוּ הֶעָנָ֖ן שֵׁ֣שֶׁת יָמִ֑ים וַיִּקְרָ֧א אֶל־מֹשֶׁ֛ה בַּיֹּ֥ום הַשְּׁבִיעִ֖י מִתֹּ֥וךְ הֶעָנָֽן׃ ,וַיְכַסֵּ֥הוּ הֶעָנָ֖ן שֵׁ֣שֶׁת יָמִ֑ים ,שֵׁ֣שֶׁת יָמִ֑ים ,Time
6576,436908,Exodus 32:6,clause_x,וַיַּשְׁכִּ֨ימוּ֙ מִֽמָּחֳרָ֔ת וַיַּעֲל֣וּ עֹלֹ֔ת וַיַּגִּ֖שׁוּ שְׁלָמִ֑ים וַיֵּ֤שֶׁב הָעָם֙ לֶֽאֱכֹ֣ל וְשָׁתֹ֔ו וַיָּקֻ֖מוּ לְצַחֵֽק׃ פ ,וַיַּשְׁכִּ֨ימוּ֙ מִֽמָּחֳרָ֔ת ,מִֽמָּחֳרָ֔ת ,Time
6586,436957,Exodus 32:13,clause_x,זְכֹ֡ר לְאַבְרָהָם֩ לְיִצְחָ֨ק וּלְיִשְׂרָאֵ֜ל עֲבָדֶ֗יךָ אֲשֶׁ֨ר נִשְׁבַּ֣עְתָּ לָהֶם֮ בָּךְ֒ וַתְּדַבֵּ֣ר אֲלֵהֶ֔ם אַרְבֶּה֙ אֶֽת־זַרְעֲכֶ֔ם כְּכֹוכְבֵ֖י הַשָּׁמָ֑יִם וְכָל־הָאָ֨רֶץ הַזֹּ֜את אֲשֶׁ֣ר אָמַ֗רְתִּי אֶתֵּן֙ לְזַרְעֲכֶ֔ם וְנָחֲל֖וּ לְעֹלָֽם׃ ,וְנָחֲל֖וּ לְעֹלָֽם׃ ,לְעֹלָֽם׃ ,Time
6664,437249,Exodus 34:18,clause_x,אֶת־חַ֣ג הַמַּצֹּות֮ תִּשְׁמֹר֒ שִׁבְעַ֨ת יָמִ֜ים תֹּאכַ֤ל מַצֹּות֙ אֲשֶׁ֣ר צִוִּיתִ֔ךָ לְמֹועֵ֖ד חֹ֣דֶשׁ הָאָבִ֑יב כִּ֚י בְּחֹ֣דֶשׁ הָֽאָבִ֔יב יָצָ֖אתָ מִמִּצְרָֽיִם׃ ,אֲשֶׁ֣ר צִוִּיתִ֔ךָ לְמֹועֵ֖ד חֹ֣דֶשׁ הָאָבִ֑יב ,לְמֹועֵ֖ד חֹ֣דֶשׁ הָאָבִ֑יב ,Time
6803,437862,Exodus 40:37,clause_x,וְאִם־לֹ֥א יֵעָלֶ֖ה הֶעָנָ֑ן וְלֹ֣א יִסְע֔וּ עַד־יֹ֖ום הֵעָלֹתֹֽו׃ ,וְלֹ֣א יִסְע֔וּ עַד־יֹ֖ום ,עַד־יֹ֖ום ,Time
7034,438757,Leviticus 10:19,clause_x,וַיְדַבֵּ֨ר אַהֲרֹ֜ן אֶל־מֹשֶׁ֗ה הֵ֣ן הַ֠יֹּום הִקְרִ֨יבוּ אֶת־חַטָּאתָ֤ם וְאֶת־עֹֽלָתָם֙ לִפְנֵ֣י יְהוָ֔ה וַתִּקְרֶ֥אנָה אֹתִ֖י כָּאֵ֑לֶּה וְאָכַ֤לְתִּי חַטָּאת֙ הַיֹּ֔ום הַיִּיטַ֖ב בְּעֵינֵ֥י יְהוָֽה׃ ,וְאָכַ֤לְתִּי חַטָּאת֙ הַיֹּ֔ום ,הַיֹּ֔ום ,Time
